ProbeName,TargetName,Target_Name,HUGOSymbol,Accessions,AnalyteType,CodeClass,TargetGroup
DPROT_00900.1,PTEN,PTEN,PTEN,"P60484,F6KD01",Protein,Endogenous,"All Targets, Cell Adhesion & Motility, Lipid Metabolism, p53 Signaling, PI3K-Akt Signaling, FoxO Signaling, Autophagy, mTOR Signaling, TCR Signaling, Senescence, EMT"
DPROT_01027.1,Cathepsin G,Cathepsin G,CTSG,P08311,Protein,Endogenous,"All Targets, Matrix Remodeling and Metastasis, Lysosome, IL-1 Signaling"
DPROT_01029.1,beta Actin,beta Actin,ACTB,"P60709,Q1KLZ0",Protein,Endogenous,"All Targets, VEGF Signaling, Epigenetic Modification, Cell Adhesion & Motility, Apoptosis, Lymphocyte Trafficking, Endocytosis, DNA Damage Repair, Differentiation, MAPK Signaling, TGF-beta Signaling"
DPROT_01101.1,TAK1,TAK1,MAP3K7,O43318,Protein,Endogenous,"All Targets, TNF Signaling, NF-kB Signaling, Myeloid Inflammation, MAPK Signaling, Autophagy, TCR Signaling, IL-17 Signaling, TLR Signaling, Wnt Signaling, IL-1 Signaling, AMPK Signaling"
DPROT_01058.1,PRAME,PRAME,PRAME,"B7ZAT0,A0A024R1E6,B7Z7K8,P78395,B7Z986",Protein,Endogenous,"All Targets, Cancer Antigens"
DPROT_01019.1,ALK,ALK,ALK,"Q9UM73,B6D4Y2",Protein,Endogenous,All Targets
DPROT_00845.1,CDK1 + Cdk2 + Cdk3 (phospho T14),CDK1 + Cdk2 + Cdk3 (phospho T14),"CDK1,CDK2,CDK3","A0A024RB77,A0A024RB10,P06493,Q00526,E7ESI2,G3V5T9,A0A024QZJ8,I6L9I5,B4DDL9,B7Z3D6,P24941",Protein,Endogenous,"All Targets, Oxidative Stress, p53 Signaling, DNA Damage Repair, Differentiation, PI3K-Akt Signaling, MAPK Signaling, FoxO Signaling, Senescence, Cell Cycle"
DPROT_00522.1,E Cadherin,E Cadherin,CDH1,"P12830,A0A0U2ZQU7,Q9UII7,B3GN61",Protein,Endogenous,"All Targets, Matrix Remodeling and Metastasis, Cell Adhesion & Motility, Apoptosis, Lymphocyte Regulation, EMT"
DPROT_00389.1,Cytokeratin 19,Cytokeratin 19,KRT19,P08727,Protein,Endogenous,"All Targets, Androgen Signaling, Estrogen Signaling, Differentiation"
DPROT_01125.1,GRP78 BiP,GRP78 BiP,HSPA5,"V9HWB4,P11021",Protein,Endogenous,"All Targets, Proteotoxic Stress, MHC Class I Antigen Presentation, mTOR Signaling"
DPROT_00849.1,CD36,CD36,CD36,"B7Z6C3,A4D1B1,P16671,E9PLT1",Protein,Endogenous,"All Targets, Oxidative Stress, Lipid Metabolism, MHC Class I Antigen Presentation, Differentiation, Other Interleukin Signaling, PPAR Signaling, TLR Signaling, NO Signaling, AMPK Signaling"
DPROT_00896.1,mTOR,mTOR,MTOR,P42345,Protein,Endogenous,"All Targets, Insulin Signaling, VEGF Signaling, TH17 Differentiation, p53 Signaling, PI3K-Akt Signaling, Autophagy, mTOR Signaling, HIF1 Signaling, JAK-STAT Signaling, Senescence, AMPK Signaling, EMT"
DPROT_00962.1,TROP2,TROP2,TACSTD2,P09758,Protein,Endogenous,All Targets
DPROT_00843.1,C4a,C4a,"C4A,C4B,C4B_2","P0C0L5,P0C0L4",Protein,Endogenous,"All Targets, Complement System"
DPROT_00420.1,Cyclin B1,Cyclin B1,CCNB1,P14635,Protein,Endogenous,"All Targets, p53 Signaling, FoxO Signaling, Senescence, Cell Cycle"
DPROT_00161.1,SIRT2,SIRT2,SIRT2,"A0A024R0G8,A0A0A0MRF5,Q8IXJ6",Protein,Endogenous,"All Targets, Oxidative Stress, Cell Cycle"
DPROT_00730.1,CXCR3,CXCR3,CXCR3,P49682,Protein,Endogenous,"All Targets, Chemokine Signaling"
DPROT_00805.1,EpCAM,EpCAM,EPCAM,P16422,Protein,Endogenous,"All Targets, EMT"
DPROT_00914.1,VISTA,VISTA,VSIR,Q9H7M9,Protein,Endogenous,"All Targets, Cell Adhesion & Motility, T-cell Checkpoints"
DPROT_00982.1,PI 3 Kinase catalytic subunit gamma/PI3K-gamma,PI 3 Kinase catalytic subunit gamma/PI3K-gamma,PIK3CG,"A8K9G9,A0A024R720,P48736",Protein,Endogenous,"All Targets, Lipid Metabolism, PI3K-Akt Signaling, Chemokine Signaling"
DPROT_00759.1,IL-1RA,IL-1RA,IL1RN,"P18510,A0A024R528",Protein,Endogenous,"All Targets, Other Interleukin Signaling, IL-1 Signaling"
DPROT_01204.1,C5 / C5b,C5 / C5b,C5,"P01031,Q59GS8",Protein,Endogenous,"All Targets, Complement System"
DPROT_01182.1,PD1,PD1,PDCD1,"Q15116,A0A0M3M0G7",Protein,Endogenous,"All Targets, T Cell Exhaustion, Cell Adhesion & Motility, TCR Signaling, T-cell Checkpoints"
DPROT_00929.1,STAT5b,STAT5b,STAT5B,P51692,Protein,Endogenous,"All Targets, PDGF Signaling, Other Interleukin Signaling, TH2 Differentiation, Chemokine Signaling, JAK-STAT Signaling, IL-2 Signaling"
DPROT_01147.1,Cyclin A2,Cyclin A2,CCNA2,P20248,Protein,Endogenous,"All Targets, Myc, Epigenetic Modification, Oxidative Stress, DNA Damage Repair, Senescence, Cell Cycle, AMPK Signaling"
DPROT_00935.1,SIRT1 (phospho S47),SIRT1 (phospho S47),SIRT1,"A0A024QZQ1,A8K128,B0QZ35,E9PC49,Q96EB6",Protein,Endogenous,"All Targets, Androgen Signaling, Oxidative Stress, FoxO Signaling, Senescence, AMPK Signaling, EMT"
DPROT_01006.1,TLR9,TLR9,TLR9,Q9NR96,Protein,Endogenous,"All Targets, Insulin Signaling, TLR Signaling"
DPROT_00338.1,gamma H2A.X (phospho S139),gamma H2A.X (phospho S139),H2AX,P16104,Protein,Endogenous,"All Targets, Notch Signaling, Immortality & Stemness, Epigenetic Modification, DNA Damage Repair, Estrogen Signaling, Differentiation, Senescence, Wnt Signaling, Cell Cycle"
DPROT_00243.1,Tuberin (phospho T1462),Tuberin (phospho T1462),TSC2,"Q5HYF7,H3BMQ0,B3KWH7,X5D7Q2,P49815",Protein,Endogenous,"All Targets, Insulin Signaling, p53 Signaling, PI3K-Akt Signaling, Autophagy, mTOR Signaling, Senescence, AMPK Signaling"
DPROT_01175.1,Sonic Hedgehog,Sonic Hedgehog,SHH,Q15465,Protein,Endogenous,"All Targets, Hedgehog Signaling, EMT"
DPROT_00932.1,STAT4,STAT4,STAT4,Q14765,Protein,Endogenous,"All Targets, TH1 Differentiation, Other Interleukin Signaling, JAK-STAT Signaling, IL-2 Signaling"
DPROT_00977.1,Syk (phospho Y352) +ZAP70 (phospho Y319),Syk (phospho Y352) +ZAP70 (phospho Y319),"SYK,ZAP70","P43403,P43405,A0A024R244,A0A024R273",Protein,Endogenous,"All Targets, NF-kB Signaling, Myeloid Inflammation, PI3K-Akt Signaling, Other Interleukin Signaling, TCR Signaling, IL-2 Signaling"
DPROT_00921.1,SMAD5,SMAD5,SMAD5,"Q68DB7,Q99717",Protein,Endogenous,"All Targets, TGF-beta Signaling"
DPROT_00868.1,MSH2,MSH2,MSH2,P43246,Protein,Endogenous,"All Targets, p53 Signaling, DNA Damage Repair"
DPROT_00952.1,CD134 / OX40L receptor,CD134 / OX40L receptor,TNFRSF4,P43489,Protein,Endogenous,"All Targets, NF-kB Signaling, T-cell Checkpoints"
DPROT_00025.1,TGF beta 1,TGF beta 1,TGFB1,P01137,Protein,Endogenous,"All Targets, Treg Differentiation, TH17 Differentiation, Differentiation, MAPK Signaling, FoxO Signaling, Other Interleukin Signaling, Senescence, Cell Cycle, TGF-beta Signaling, EMT"
DPROT_01155.1,Smad3 (phospho S423 + S425),Smad3 (phospho S423 + S425),SMAD3,"Q9P0T0,A0A024R5Z3,P84022",Protein,Endogenous,"All Targets, Notch Signaling, Treg Differentiation, TH17 Differentiation, Endocytosis, Differentiation, FoxO Signaling, Senescence, Wnt Signaling, IL-1 Signaling, Cell Cycle, TGF-beta Signaling, EMT"
DPROT_00600.1,ICAM1,ICAM1,ICAM1,P05362,Protein,Endogenous,"All Targets, TNF Signaling, NF-kB Signaling, Cell Adhesion & Motility, Lymphocyte Trafficking, Lymphocyte Regulation, Other Interleukin Signaling, Type II Interferon Signaling"
DPROT_00842.1,ASS1,ASS1,ASS1,"Q5T6L4,P00966",Protein,Endogenous,"All Targets, IDH1/2, TGF-beta Signaling"
DPROT_01082.1,Glucose 6 Phosphate Dehydrogenase,Glucose 6 Phosphate Dehydrogenase,G6PD,P11413,Protein,Endogenous,"All Targets, NRF2 Signaling, Oxidative Stress, p53 Signaling, mTOR Signaling"
DPROT_00864.1,MUC1,MUC1,MUC1,"A6ZID7,B6ECB3,A5YRV0,A0A087X2A4,A5YRU7,A0A0C4DGW3,A5YRU5,A5YRV2,Q7Z551,A6ZID6,A0A087X0L2,A6ZIE6,A6ZIE4,P15941,A0A0A0MRB3,Q7Z538",Protein,Endogenous,"All Targets, Other Interleukin Signaling, EMT"
DPROT_00796.1,HLA-C,HLA-C,HLA-C,"P10321,Q95HC2,Q6R739,O19617",Protein,Endogenous,"All Targets, Cell Adhesion & Motility, Endocytosis, Lymphocyte Regulation, MHC Class I Antigen Presentation, Type II Interferon Signaling, Type I Interferon Signaling, Senescence"
DPROT_00879.1,Topoisomerase I,Topoisomerase I,TOP1,"Q9BVT2,P11387",Protein,Endogenous,All Targets
DPROT_01043.1,PRAS40,PRAS40,AKT1S1,"A0A024QZF6,Q96B36",Protein,Endogenous,"All Targets, PI3K-Akt Signaling, Autophagy, mTOR Signaling, AMPK Signaling"
DPROT_00791.1,IGF1 Receptor,IGF1 Receptor,IGF1R,"C9J5X1,P08069",Protein,Endogenous,"All Targets, Epigenetic Modification, Cell Adhesion & Motility, Endocytosis, PI3K-Akt Signaling, MAPK Signaling, FoxO Signaling, Autophagy, mTOR Signaling, HIF1 Signaling, AMPK Signaling, EMT"
DPROT_01212.1,IL-33,IL-33,IL33,O95760,Protein,Endogenous,"All Targets, IL-1 Signaling"
DPROT_00225.1,IFNGR1,IFNGR1,IFNGR1,"P15260,A0A0S2Z3Y2",Protein,Endogenous,"All Targets, TH1 Differentiation, Type II Interferon Signaling, HIF1 Signaling, JAK-STAT Signaling"
DPROT_00933.1,Topoisomerase II alpha (phospho S1106),Topoisomerase II alpha (phospho S1106),TOP2A,P11388,Protein,Endogenous,"All Targets, Cell Cycle"
DPROT_01123.1,IRF3,IRF3,IRF3,"E2GIM5,E2GIM6,E2GIM7,Q14653,E2GIM8,E2GIM9,M0QYT9",Protein,Endogenous,"All Targets, Type II Interferon Signaling, Type I Interferon Signaling, TLR Signaling, Interferon Response Genes"
DPROT_01008.1,NFkB p105 / p50,NFkB p105 / p50,NFKB1,"A0A024RDJ4,P19838",Protein,Endogenous,"All Targets, TNF Signaling, TH1 Differentiation, NF-kB Signaling, Epigenetic Modification, Apoptosis, Myeloid Inflammation, Differentiation, PI3K-Akt Signaling, MAPK Signaling, Chemokine Signaling, TCR Signaling, IL-17 Signaling, HIF1 Signaling, TLR Signaling, Senescence, IL-1 Signaling, EMT"
DPROT_01081.1,CREB,CREB,CREB1,"P16220,B7Z5C6,Q5U0J5,Q53X93",Protein,Endogenous,"All Targets, TNF Signaling, Notch Signaling, NRF2 Signaling, Estrogen Signaling, Differentiation, PI3K-Akt Signaling, IL-17 Signaling, Mitochondrial Metabolism / TCA, TLR Signaling, AMPK Signaling"
DPROT_00578.1,2B4,2B4,CD244,Q9BZW8,Protein,Endogenous,"All Targets, T Cell Exhaustion"
DPROT_00105.1,CD39,CD39,ENTPD1,P49961,Protein,Endogenous,All Targets
DPROT_00978.1,NSD3,NSD3,NSD3,Q9BZ95,Protein,Endogenous,"All Targets, Epigenetic Modification"
DPROT_00590.1,TRAF6,TRAF6,TRAF6,Q9Y4K3,Protein,Endogenous,"All Targets, NF-kB Signaling, Myeloid Inflammation, Endocytosis, MAPK Signaling, Autophagy, TCR Signaling, IL-17 Signaling, TLR Signaling, IL-1 Signaling"
DPROT_00837.1,GSK3 beta,GSK3 beta,GSK3B,"P49841,Q6FI27",Protein,Endogenous,"All Targets, Insulin Signaling, Cell Adhesion & Motility, Hedgehog Signaling, Differentiation, PI3K-Akt Signaling, mTOR Signaling, Chemokine Signaling, TCR Signaling, Wnt Signaling, Cell Cycle, EMT"
DPROT_00052.1,CD163,CD163,CD163,Q86VB7,Protein,Endogenous,All Targets
DPROT_00835.1,CDK1 + CDK2 + CDK3 + CDK5 (phospho Y15),CDK1 + CDK2 + CDK3 + CDK5 (phospho Y15),"CDK1,CDK2,CDK3,CDK5","A0A024RB77,A0A024RB10,P06493,Q00526,E7ESI2,G3V5T9,A0A024QZJ8,I6L9I5,B4DDL9,A0A090N7W4,Q00535,B7Z3D6,P24941,A0A0S2Z355",Protein,Endogenous,"All Targets, Oxidative Stress, p53 Signaling, DNA Damage Repair, Differentiation, PI3K-Akt Signaling, MAPK Signaling, FoxO Signaling, Senescence, Cell Cycle"
DPROT_01050.1,TIM 3,TIM 3,HAVCR2,Q8TDQ0,Protein,Endogenous,"All Targets, T Cell Exhaustion, T-cell Checkpoints, IL-2 Signaling"
DPROT_00874.1,Wnt3a,Wnt3a,WNT3A,P56704,Protein,Endogenous,"All Targets, mTOR Signaling, Wnt Signaling"
DPROT_00920.1,PKC beta 1,PKC beta 1,PRKCB,P05771,Protein,Endogenous,"All Targets, VEGF Signaling, NF-kB Signaling, Cell Adhesion & Motility, NRF2 Signaling, Lymphocyte Trafficking, MAPK Signaling, mTOR Signaling, Chemokine Signaling, HIF1 Signaling, Wnt Signaling, Cell Cycle"
DPROT_00986.1,TAP2,TAP2,TAP2,"Q5JNW1,X5CMH5,Q9UP03,Q03519",Protein,Endogenous,"All Targets, MHC Class I Antigen Presentation, Drug Resistance"
DPROT_00882.1,RSK1 p90,RSK1 p90,RPS6KA1,Q15418,Protein,Endogenous,"All Targets, Differentiation, MAPK Signaling, mTOR Signaling, IL-17 Signaling, TLR Signaling, Senescence"
DPROT_00774.1,GLB1/Beta-galactosidase,GLB1/Beta-galactosidase,GLB1,"B7Z6Q5,P16278",Protein,Endogenous,"All Targets, Lipid Metabolism, Lysosome"
DPROT_00889.1,Nanog,Nanog,NANOG,"Q9H9S0,A8K4D1",Protein,Endogenous,"All Targets, Immortality & Stemness, Differentiation, Other Interleukin Signaling, EMT"
DPROT_00971.1,MX1,MX1,MX1,P20591,Protein,Endogenous,"All Targets, Type I Interferon Signaling, Interferon Response Genes"
DPROT_01188.1,Topoisomerase II alpha,Topoisomerase II alpha,TOP2A,P11388,Protein,Endogenous,"All Targets, Cell Cycle"
DPROT_01145.1,ICOS,ICOS,ICOS,"Q9Y6W8,Q53QY6",Protein,Endogenous,"All Targets, Cell Adhesion & Motility, TCR Signaling, T-cell Checkpoints"
DPROT_01073.1,Tuberin (phospho S1254),Tuberin (phospho S1254),TSC2,"Q5HYF7,H3BMQ0,B3KWH7,X5D7Q2,P49815",Protein,Endogenous,"All Targets, Insulin Signaling, p53 Signaling, PI3K-Akt Signaling, Autophagy, mTOR Signaling, Senescence, AMPK Signaling"
DPROT_01013.1,CREBBP,CREBBP,CREBBP,Q92793,Protein,Endogenous,"All Targets, Notch Signaling, Epigenetic Modification, Lipid Metabolism, Estrogen Signaling, Differentiation, FoxO Signaling, HIF1 Signaling, Mitochondrial Metabolism / TCA, JAK-STAT Signaling, Wnt Signaling, Cell Cycle, TGF-beta Signaling"
DPROT_00417.1,CD16,CD16,FCGR3A,"M9MML0,P08637",Protein,Endogenous,"All Targets, Lymphocyte Regulation"
DPROT_01177.1,Caspase-3 p12,Caspase-3 p12,CASP3,P42574,Protein,Endogenous,"All Targets, TNF Signaling, T Cell Exhaustion, Matrix Remodeling and Metastasis, Apoptosis, Oxidative Stress, Hippo Signaling, p53 Signaling, MAPK Signaling, Other Interleukin Signaling"
DPROT_00226.1,BRAF,BRAF,BRAF,P15056,Protein,Endogenous,"All Targets, Insulin Signaling, Cell Adhesion & Motility, FGFR Signaling, MAPK Signaling, FoxO Signaling, mTOR Signaling, Chemokine Signaling"
DPROT_00862.1,SIRT3,SIRT3,SIRT3,Q9NTG7,Protein,Endogenous,"All Targets, Oxidative Stress, Mitochondrial Metabolism / TCA"
DPROT_01115.1,MEK2,MEK2,MAP2K2,P36507,Protein,Endogenous,"All Targets, Insulin Signaling, VEGF Signaling, Apoptosis, Myeloid Inflammation, Estrogen Signaling, Differentiation, PI3K-Akt Signaling, MAPK Signaling, FoxO Signaling, Autophagy, mTOR Signaling, TCR Signaling, HIF1 Signaling, TLR Signaling, Senescence"
DPROT_01004.1,LDL Receptor,LDL Receptor,LDLR,"A0A024R7D5,P01130",Protein,Endogenous,"All Targets, Endocytosis, mTOR Signaling"
DPROT_01025.1,RAGE,RAGE,AGER,"A0A1U9X785,B4DNX3,Q15109",Protein,Endogenous,"All Targets, TLR Signaling, RAGE Signaling, IL-1 Signaling, EMT"
DPROT_00938.1,Sumo 1,Sumo 1,SUMO1,"P63165,A0A024R3Z2",Protein,Endogenous,"All Targets, DNA Damage Repair, Type II Interferon Signaling, Cell Cycle"
DPROT_01030.1,MMP8,MMP8,MMP8,"B4E0I2,P22894",Protein,Endogenous,"All Targets, Matrix Remodeling and Metastasis"
DPROT_01150.1,p38 (phospho T180),p38 (phospho T180),MAPK14,"Q16539,A0A024RD15,L7RSM2,B4E0K5",Protein,Endogenous,"All Targets, TNF Signaling, VEGF Signaling, TH17 Differentiation, NRF2 Signaling, Myeloid Inflammation, Lymphocyte Trafficking, Differentiation, MAPK Signaling, FoxO Signaling, TCR Signaling, IL-17 Signaling, Mitochondrial Metabolism / TCA, TLR Signaling, Senescence"
DPROT_00617.1,CDKN2A/p16INK4a,CDKN2A/p16INK4a,CDKN2A,"K7PML8,G3XAG3,Q8N726,P42771",Protein,Endogenous,"All Targets, Apoptosis, p53 Signaling, Senescence, Cell Cycle"
DPROT_00870.1,Mucin 5AC,Mucin 5AC,MUC5AC,P98088,Protein,Endogenous,All Targets
DPROT_00298.1,SQSTM1 / p62,SQSTM1 / p62,SQSTM1,Q13501,Protein,Endogenous,"All Targets, NF-kB Signaling, Autophagy, mTOR Signaling, Senescence, IL-1 Signaling"
DPROT_01190.1,Glutathione Peroxidase 4,Glutathione Peroxidase 4,GPX4,"P36969,Q6PI42",Protein,Endogenous,"All Targets, Oxidative Stress, Lipid Metabolism"
DPROT_01168.1,Ki67,Ki67,MKI67,P46013,Protein,Endogenous,All Targets
DPROT_01061.1,Syk,Syk,SYK,"P43405,A0A024R244,A0A024R273",Protein,Endogenous,"All Targets, NF-kB Signaling, Myeloid Inflammation, PI3K-Akt Signaling, Other Interleukin Signaling, IL-2 Signaling"
DPROT_00923.1,ZAP70,ZAP70,ZAP70,P43403,Protein,Endogenous,"All Targets, NF-kB Signaling, TCR Signaling"
DPROT_00291.1,CSF-1-R,CSF-1-R,CSF1R,P07333,Protein,Endogenous,"All Targets, Epigenetic Modification, PI3K-Akt Signaling, MAPK Signaling, Other Interleukin Signaling"
DPROT_00963.1,S100A12/CGRP,S100A12/CGRP,S100A12,P80511,Protein,Endogenous,"All Targets, TLR Signaling, RAGE Signaling, IL-1 Signaling"
DPROT_01055.1,APC,APC,APC,"P25054,Q4LE70",Protein,Endogenous,"All Targets, Apoptosis, Wnt Signaling"
DPROT_00495.1,Rb (phospho T252),Rb (phospho T252),RB1,"P06400,A0A024RDV3",Protein,Endogenous,"All Targets, Androgen Signaling, Senescence, Cell Cycle"
DPROT_01151.1,beta Arrestin 1,beta Arrestin 1,ARRB1,"B7Z1Q3,P49407",Protein,Endogenous,"All Targets, Notch Signaling, Endocytosis, Hedgehog Signaling, MAPK Signaling, Chemokine Signaling"
DPROT_00987.1,SIGLEC5,SIGLEC5,SIGLEC5,O15389,Protein,Endogenous,"All Targets, Lymphocyte Regulation"
DPROT_01098.1,Fos B,Fos B,FOSB,"A0A024R0P6,P53539",Protein,Endogenous,"All Targets, Estrogen Signaling"
DPROT_00937.1,PF4,PF4,PF4,P02776,Protein,Endogenous,"All Targets, Chemokine Signaling"
DPROT_01048.1,NKG2A + NKG2E + NKG2C,NKG2A + NKG2E + NKG2C,"KLRC1,KLRC3,KLRC2","Q07444,P26717,P26715",Protein,Endogenous,"All Targets, Lymphocyte Regulation"
DPROT_01110.1,Smac/Diablo,Smac/Diablo,DIABLO,"A0A0S2Z5P6,Q9NR28,A0A0S2Z5U7,Q502X2,A0A024RBT2,K7X1S0",Protein,Endogenous,"All Targets, Apoptosis, Oxidative Stress"
DPROT_00931.1,Topoisomerase II alpha (phospho T1343),Topoisomerase II alpha (phospho T1343),TOP2A,P11388,Protein,Endogenous,"All Targets, Cell Cycle"
DPROT_01002.1,CDK1,CDK1,CDK1,"I6L9I5,P06493,B7Z3D6,A0A024QZJ8",Protein,Endogenous,"All Targets, Oxidative Stress, p53 Signaling, MAPK Signaling, Senescence, Cell Cycle"
DPROT_00819.1,ENO1 + ENO2 + ENO3,ENO1 + ENO2 + ENO3,"ENO1,ENO2,ENO3","P09104,P06733,P13929,Q6FHV6,A0A024R4F1",Protein,Endogenous,"All Targets, Glycolysis & Glucose Transport, Myc, mTOR Signaling, HIF1 Signaling"
DPROT_01038.1,BRCA1,BRCA1,BRCA1,"A0A024R1V0,P38398",Protein,Endogenous,"All Targets, Androgen Signaling, p53 Signaling, DNA Damage Repair, PI3K-Akt Signaling, Cell Cycle"
DPROT_00991.1,Urokinase,Urokinase,PLAU,"B4DNJ4,A0A024QZM9,P00749,Q59GZ8",Protein,Endogenous,"All Targets, NF-kB Signaling, Epigenetic Modification, Complement System"
DPROT_00393.1,Syndecan-1,Syndecan-1,SDC1,P18827,Protein,Endogenous,"All Targets, Cell Adhesion & Motility, Oxidative Stress, Other Interleukin Signaling"
DPROT_00729.1,Insulin,Insulin,INS,"I3WAC9,P01308",Protein,Endogenous,"All Targets, Insulin Signaling, Oxidative Stress, Differentiation, PI3K-Akt Signaling, MAPK Signaling, FoxO Signaling, Autophagy, mTOR Signaling, HIF1 Signaling, NO Signaling, AMPK Signaling"
DPROT_01154.1,15-PGDH,15-PGDH,HPGD,P15428,Protein,Endogenous,"All Targets, Prostaglandin Inflammation, Androgen Signaling, Epigenetic Modification, Lipid Metabolism"
DPROT_00992.1,PI 3 Kinase p85 alpha,PI 3 Kinase p85 alpha,PIK3R1,P27986,Protein,Endogenous,"All Targets, Insulin Signaling, TNF Signaling, VEGF Signaling, ERBB2 Signaling, Cell Adhesion & Motility, PDGF Signaling, Apoptosis, Myeloid Inflammation, Lymphocyte Trafficking, FGFR Signaling, Lipid Metabolism, EGFR Signaling, Estrogen Signaling, Differentiation, PI3K-Akt Signaling, FoxO Signaling, Other Interleukin Signaling, Autophagy, mTOR Signaling, Chemokine Signaling, TCR Signaling, HIF1 Signaling, TLR Signaling, JAK-STAT Signaling, Senescence, MET Signaling, AMPK Signaling, IL-2 Signaling"
DPROT_01138.1,JNK1 + JNK2 + JNK3 (phospho T183+T183+T221),JNK1 + JNK2 + JNK3 (phospho T183+T183+T221),"MAPK8,MAPK9,MAPK10","D7R525,A0A286YF97,P53779,A8MWW6,Q499Y8,P45984,A1L4K2,P45983",Protein,Endogenous,"All Targets, Insulin Signaling, TNF Signaling, Proteotoxic Stress, Cell Adhesion & Motility, NRF2 Signaling, Apoptosis, Myeloid Inflammation, Oxidative Stress, DNA Damage Repair, Differentiation, MAPK Signaling, FoxO Signaling, Autophagy, TCR Signaling, IL-17 Signaling, TLR Signaling, Senescence, Wnt Signaling, IL-1 Signaling"
DPROT_00753.1,CCL18,CCL18,CCL18,P55774,Protein,Endogenous,"All Targets, Chemokine Signaling, EMT"
DPROT_00598.1,iNOS,iNOS,NOS2,P35228,Protein,Endogenous,"All Targets, Other Interleukin Signaling, HIF1 Signaling, NO Signaling"
DPROT_00011.1,CD11c,CD11c,ITGAX,"P20702,H3BN02",Protein,Endogenous,"All Targets, Other Interleukin Signaling, Complement System"
DPROT_01196.1,ACE2,ACE2,ACE2,Q9BYF1,Protein,Endogenous,All Targets
DPROT_01173.1,FOXO1A,FOXO1A,FOXO1,Q12778,Protein,Endogenous,"All Targets, Insulin Signaling, Treg Differentiation, Epigenetic Modification, Oxidative Stress, Differentiation, PI3K-Akt Signaling, MAPK Signaling, FoxO Signaling, Other Interleukin Signaling, Senescence, AMPK Signaling"
DPROT_01070.1,CD63,CD63,CD63,"A0A024RB05,P08962",Protein,Endogenous,"All Targets, Lysosome"
DPROT_01171.1,CD272/BTLA,CD272/BTLA,BTLA,Q7Z6A9,Protein,Endogenous,All Targets
DPROT_00876.1,STING,STING,STING1,"Q86WV6,V5V0K2",Protein,Endogenous,All Targets
DPROT_01176.1,MyD88,MyD88,MYD88,"A0A0A0MS70,A0A0A0MST0,Q99836,A0A0A0MSI9",Protein,Endogenous,"All Targets, NF-kB Signaling, MHC Class I Antigen Presentation, MAPK Signaling, TLR Signaling, IL-1 Signaling"
DPROT_01142.1,Granzyme B,Granzyme B,GZMB,"Q67BC3,J3KQ52,P10144,Q6XGZ4",Protein,Endogenous,"All Targets, Notch Signaling, Epigenetic Modification, Apoptosis, Cytotoxicity"
DPROT_01103.1,Histone H3 (tri methyl K9),Histone H3 (tri methyl K9),"H3C2,H3C11,H3C10,H3C3,H3C12,H3C1,H3C6,H3C7,H3C4,H3C8",P68431,Protein,Endogenous,"All Targets, Notch Signaling, Epigenetic Modification, Estrogen Signaling, Differentiation, Other Interleukin Signaling, Senescence, Wnt Signaling, Cell Cycle"
DPROT_00951.1,STAT6 (phospho Y641),STAT6 (phospho Y641),STAT6,"A8K4S9,B4DQB3,P42226",Protein,Endogenous,"All Targets, PDGF Signaling, Oxidative Stress, Other Interleukin Signaling, TH2 Differentiation, JAK-STAT Signaling"
DPROT_00611.1,Cdk4,Cdk4,CDK4,"P11802,A0A024RBB6",Protein,Endogenous,"All Targets, Myc, Epigenetic Modification, p53 Signaling, Differentiation, PI3K-Akt Signaling, TCR Signaling, Senescence, Cell Cycle"
DPROT_01210.1,CD22,CD22,CD22,"P20273,Q0EAF5",Protein,Endogenous,"All Targets, Cell Adhesion & Motility, Lymphocyte Regulation"
DPROT_00167.1,VCAM1,VCAM1,VCAM1,P19320,Protein,Endogenous,"All Targets, TNF Signaling, NF-kB Signaling, Cell Adhesion & Motility, Lymphocyte Trafficking, Lymphocyte Regulation, Other Interleukin Signaling, Type II Interferon Signaling"
DPROT_00812.1,CD44v6,CD44v6,CD44,P16070,Protein,Endogenous,"All Targets, Immortality & Stemness, Matrix Remodeling and Metastasis, Type II Interferon Signaling, EMT"
DPROT_00970.1,CD133,CD133,PROM1,"O43490,A0A0A0N0M1",Protein,Endogenous,"All Targets, Immortality & Stemness, Epigenetic Modification, EMT"
DPROT_00894.1,PI 3 Kinase catalytic subunit alpha/PIK3CA,PI 3 Kinase catalytic subunit alpha/PIK3CA,PIK3CA,"P42336,Q4LE51",Protein,Endogenous,"All Targets, Insulin Signaling, TNF Signaling, VEGF Signaling, ERBB2 Signaling, Cell Adhesion & Motility, PDGF Signaling, Apoptosis, Myeloid Inflammation, Lymphocyte Trafficking, FGFR Signaling, Lipid Metabolism, EGFR Signaling, Estrogen Signaling, Differentiation, PI3K-Akt Signaling, FoxO Signaling, Other Interleukin Signaling, Autophagy, mTOR Signaling, Chemokine Signaling, TCR Signaling, HIF1 Signaling, TLR Signaling, JAK-STAT Signaling, Senescence, MET Signaling, AMPK Signaling, IL-2 Signaling, EMT"
DPROT_00762.1,Macrophage Inflammatory Protein 3 alpha,Macrophage Inflammatory Protein 3 alpha,CCL20,P78556,Protein,Endogenous,"All Targets, TNF Signaling, Other Interleukin Signaling, Chemokine Signaling, EMT"
DPROT_01218.1,Axl,Axl,AXL,"M0R0W6,P30530",Protein,Endogenous,"All Targets, VEGF Signaling, Oxidative Stress"
DPROT_01042.1,Dihydrofolate reductase (DHFR),Dihydrofolate reductase (DHFR),DHFR,"P00374,B0YJ76,B4DM58",Protein,Endogenous,"All Targets, Oxidative Stress, mTOR Signaling, Cell Cycle"
DPROT_00815.1,Aldolase B+Aldolase C,Aldolase B+Aldolase C,"ALDOC,ALDOB","P09972,P05062,A0A024R145,A0A024QZ64",Protein,Endogenous,"All Targets, Glycolysis & Glucose Transport, HIF1 Signaling"
DPROT_00974.1,PTCH2,PTCH2,PTCH2,Q9Y6C5,Protein,Endogenous,"All Targets, Hedgehog Signaling"
DPROT_00054.1,MelanA,MelanA,MLANA,Q16655,Protein,Endogenous,"All Targets, Cancer Antigens"
DPROT_00733.1,Cathepsin S,Cathepsin S,CTSS,P25774,Protein,Endogenous,"All Targets, Matrix Remodeling and Metastasis, Apoptosis, MHC Class I Antigen Presentation, TLR Signaling, Lysosome, MHC Class II Antigen Presentation"
DPROT_00891.1,ROCK1,ROCK1,ROCK1,Q13464,Protein,Endogenous,"All Targets, VEGF Signaling, Cell Adhesion & Motility, Apoptosis, Lymphocyte Trafficking, Differentiation, Chemokine Signaling, TGF-beta Signaling, EMT"
DPROT_00866.1,AMPK alpha 1,AMPK alpha 1,PRKAA1,Q13131,Protein,Endogenous,"All Targets, Insulin Signaling, Oxidative Stress, p53 Signaling, PI3K-Akt Signaling, FoxO Signaling, Autophagy, mTOR Signaling, AMPK Signaling"
DPROT_01102.1,Hexokinase II,Hexokinase II,HK2,P52789,Protein,Endogenous,"All Targets, Insulin Signaling, Glycolysis & Glucose Transport, Myc, mTOR Signaling, HIF1 Signaling"
DPROT_01072.1,Rb (phospho T780),Rb (phospho T780),RB1,"P06400,A0A024RDV3",Protein,Endogenous,"All Targets, Androgen Signaling, Senescence, Cell Cycle"
DPROT_00789.1,HDAC3,HDAC3,HDAC3,O15379,Protein,Endogenous,"All Targets, Notch Signaling, Epigenetic Modification, Lipid Metabolism, Differentiation, Mitochondrial Metabolism / TCA"
DPROT_01119.1,IGF2BP1/IMP1,IGF2BP1/IMP1,IGF2BP1,Q9NZI8,Protein,Endogenous,"All Targets, MAPK Signaling"
DPROT_00781.1,ErbB4 / HER4 (phospho Y1162),ErbB4 / HER4 (phospho Y1162),ERBB4,Q15303,Protein,Endogenous,"All Targets, PI3K-Akt Signaling, MAPK Signaling"
DPROT_01122.1,Histone H3 (acetyl K14),Histone H3 (acetyl K14),"H3C2,H3C11,H3C10,H3C3,H3C12,H3C1,H3C6,H3C7,H3C4,H3C8",P68431,Protein,Endogenous,"All Targets, Notch Signaling, Epigenetic Modification, Estrogen Signaling, Differentiation, Other Interleukin Signaling, Senescence, Wnt Signaling, Cell Cycle"
DPROT_01069.1,S100A4,S100A4,S100A4,P26447,Protein,Endogenous,"All Targets, EMT"
DPROT_00829.1,Fibronectin,Fibronectin,FN1,"Q6MZF4,Q6N084,B7ZLE5,P02751,Q9UQS6,Q6MZM7",Protein,Endogenous,"All Targets, Myc, Cell Adhesion & Motility, PI3K-Akt Signaling, MAPK Signaling, Other Interleukin Signaling, MET Signaling, EMT"
